{"policy":{"evidence_type":"bibliography_policy","path":"policy.json","root":{"discovery":"explicit:manifest.json","identity":"c2-synthetic-wiki","kind":"wiki","manifest_sha256":"4221125abecf155091593d6686c6512d54dd0219e041cd0b6672675af9d009a2"},"sha256":"d38bfae99c4b10de53a53d9134e33ef1b9eecda8a6b4d5b3224eea0c7dfbd8f1"},"publication":{"commit_marker":{"evidence_type":"publication_commit_marker","path":"reviews/.harness/fixtures/m2-initial/synthetic-bibliography-publication-marker.json","root":{"discovery":"explicit:reviews/.harness/fixtures/m2-initial/synthetic-project-manifest.json","identity":"c2-synthetic-project","kind":"project","manifest_sha256":"edada29a91002a6d597c4ae19300f2fbb59e5f77b22882eebc4f4d43dcf3cb34"},"sha256":"5ba2e64d9e1ad3626da3dccac47b02d12d3bb0957dd9ee8144aaff3c3243afb8"},"manifest":{"evidence_type":"publication_manifest","path":"reviews/.harness/fixtures/m2-initial/synthetic-bibliography-publication-manifest.json","root":{"discovery":"explicit:reviews/.harness/fixtures/m2-initial/synthetic-project-manifest.json","identity":"c2-synthetic-project","kind":"project","manifest_sha256":"edada29a91002a6d597c4ae19300f2fbb59e5f77b22882eebc4f4d43dcf3cb34"},"sha256":"8b6d08e8542a79540f29fbd3b07b244803fc9c594ce3db5c2ba7fd0fe23285c1"},"mode":"committed","transaction_id":"bibliography-5e125094598af90e"},"schema_version":"1.0.0","snapshot_id":"c2-bibliography-activation","snapshot_type":"canonical_bibliography_snapshot","sources":[{"aliases":["c2-centroid"],"authors":["Fixture, C."],"canonical_page":{"evidence_type":"canonical_source_page","path":"wiki/sources/c2-centroid.md","root":{"discovery":"explicit:manifest.json","identity":"c2-synthetic-wiki","kind":"wiki","manifest_sha256":"4221125abecf155091593d6686c6512d54dd0219e041cd0b6672675af9d009a2"},"sha256":"8dfb47e1b767eaa6b03c5eed78e3e7806bdc0bdb319d161cb01d9b481b503051"},"lookup_key":"fixture-centroid-alias","redirect_chain":["fixture-centroid-evidence"],"source":{"evidence_type":"source_pdf","path":"miniature.pdf","root":{"discovery":"explicit:reviews/.harness/fixtures/m2-initial/synthetic-project-manifest.json","identity":"c2-synthetic-project","kind":"project","manifest_sha256":"edada29a91002a6d597c4ae19300f2fbb59e5f77b22882eebc4f4d43dcf3cb34"},"sha256":"e21a489ac04667bc46d4335e604f6e6ba3fbfa27d8f473a96d0ebce9737a6c3a"},"source_key":"fixture-centroid-evidence","source_loc":"miniature.pdf","title":"Fixture centroid evidence","year":2026,"zotero_key":"C2CENTROID"},{"aliases":["c2-argument"],"authors":["Fixture, C."],"canonical_page":{"evidence_type":"canonical_source_page","path":"wiki/sources/c2-argument.md","root":{"discovery":"explicit:manifest.json","identity":"c2-synthetic-wiki","kind":"wiki","manifest_sha256":"4221125abecf155091593d6686c6512d54dd0219e041cd0b6672675af9d009a2"},"sha256":"a529817fa1f0a4ba27755c063fb4d26c71a97acd6773d3e3e01796c3692bd6e6"},"lookup_key":"fixture-argument-evidence","redirect_chain":[],"source":{"evidence_type":"source_pdf","path":"miniature.pdf","root":{"discovery":"explicit:reviews/.harness/fixtures/m2-initial/synthetic-project-manifest.json","identity":"c2-synthetic-project","kind":"project","manifest_sha256":"edada29a91002a6d597c4ae19300f2fbb59e5f77b22882eebc4f4d43dcf3cb34"},"sha256":"e21a489ac04667bc46d4335e604f6e6ba3fbfa27d8f473a96d0ebce9737a6c3a"},"source_key":"fixture-argument-evidence","source_loc":"miniature.pdf","title":"Fixture argument evidence","year":2026,"zotero_key":"C2ARGUMENT"}],"wiki_root":{"discovery":"explicit:manifest.json","identity":"c2-synthetic-wiki","kind":"wiki","manifest_sha256":"4221125abecf155091593d6686c6512d54dd0219e041cd0b6672675af9d009a2"}}
